{
  "$schema": "https://docs.proappstore.online/templates/catalogue.schema.json",
  "catalogue_version": "1.0",
  "default": "template-app",
  "selection_contract": {
    "unknown": "rejected (platform admins may override explicitly; the override is recorded)",
    "withdrawn": "rejected (admin override only)",
    "deprecated": "allowed with a warning that the caller must surface",
    "approved": "allowed",
    "omitted": "the default template (template-app) is used",
    "recorded": "apps.template_id and apps.template_rev hold the template id and the exact source commit copied at provision time"
  },
  "templates": [
    {
      "id": "template-app",
      "repo": "proappstore-online/template-app",
      "ref": "main",
      "title": "ProAppStore app template",
      "purpose": "The canonical Pro app scaffold: React 19 + Vite 8 + Tailwind 4 web/ workspace, @proappstore/sdk, registered actions (mcp.json), additive D1 migrations (migrations.json), PWA manifest and service worker, the keyless deploy / CI / compliance workflows, and the design tokens. Suits any app category.",
      "supported_categories": [
        "any"
      ],
      "requires": {
        "sdk": ">=1.16.78",
        "cli": ">=2.6.0",
        "node": ">=22",
        "pnpm": "10.x"
      },
      "capabilities": [
        "platform-auth",
        "registered-actions",
        "d1-migrations",
        "pwa",
        "design-tokens",
        "keyless-oidc-deploy",
        "ci-typecheck",
        "compliance-workflow",
        "app-shell"
      ],
      "security_compliance": {
        "status": "reviewed",
        "reviewed_at": "2026-10-23",
        "known_deviations": [
          "PAS-AUTH-001"
        ],
        "notes": "Reviewed template-app@45c6947: the items migration matches all three registered actions; reads are caller-scoped. The theme boot script uses stores-theme and viewport zoom is allowed. The deploy calls the keyless reusable pipeline. After replacing APPNAME, 20 source compliance checks pass; two warnings remain for the unbuilt bundle and long CLAUDE.md. Remaining standard deviation: initPro() omits an explicit authMode (PAS-AUTH-001); set the intended mode when building the app. The reviewed source fixture and migration/action isolation tests are in test/template-app-review.test.ts."
      },
      "maintainer": {
        "org": "proappstore-online",
        "contact": "https://github.com/proappstore-online/platform/issues"
      },
      "release": {
        "version": "2026.10.23",
        "source_commit": "45c69477bcaa1499a11ccf68ac4d6b3c1a80b152",
        "released_at": "2026-10-23"
      },
      "preview": {
        "docs": "https://docs.proappstore.online/getting-started/",
        "screenshot": null
      },
      "status": "approved",
      "deprecation": null,
      "default": true
    },
    {
      "id": "template-marketplace",
      "repo": "proappstore-online/template-marketplace",
      "ref": "main",
      "title": "Two-sided listings marketplace template",
      "purpose": "Two-sided markets: owners publish listings, seekers browse a public catalogue, save favourites, send a request (booking / application / enquiry — the noun is configurable), message the owner and review after a completed request, with blocks and reports built in. Listing photos through app.storage; an optional map mode (MAPS_ENABLED) geocodes listings through app.maps. Not for apps where the map is the primary workspace (template-map), back-office records (template-workspace) or community groups (template-membership); no payments or escrow.",
      "supported_categories": [
        "marketplace",
        "real-estate",
        "lifestyle",
        "business",
        "social"
      ],
      "requires": {
        "sdk": ">=1.16.61",
        "cli": ">=2.6.0",
        "node": ">=22",
        "pnpm": "10.x"
      },
      "capabilities": [
        "platform-auth",
        "registered-actions",
        "public-catalogue",
        "d1-migrations",
        "owner-scoping",
        "requests-lifecycle",
        "favorites",
        "messaging",
        "reviews",
        "storage-uploads",
        "maps-optional",
        "pwa",
        "keyless-oidc-deploy"
      ],
      "security_compliance": {
        "status": "reviewed",
        "reviewed_at": "2026-09-25",
        "known_deviations": [],
        "notes": "Static audit at staging (a268bee, #191): pas check passes every hard check once APPNAME is replaced (re-run 2026-09-28; in the template itself only the placeholder check fails, by design); the manifest registers through the platform's own validation (manifest rules, PAS-DATA-011 public-tool rules, :__user_id scoping, schema coherence) and the migrations pass the additive-only lint (test/template-marketplace.test.ts). Five public reads name their columns and never expose a reviewer's id; every other statement is scoped to the owner, requester or message pair, transitions are guarded in SQL, and blocks are enforced in SQL. Fixes the base template's three known deviations (PAS-AUTH-001, PAS-UI-002, PAS-UI-007)."
      },
      "maintainer": {
        "org": "proappstore-online",
        "contact": "https://github.com/proappstore-online/platform/issues"
      },
      "release": {
        "version": "2026.09.25",
        "source_commit": "4b000c9967dbd7981e4d45cbfdfffba680beb8e7",
        "released_at": "2026-09-25"
      },
      "preview": {
        "docs": "https://docs.proappstore.online/templates/",
        "screenshot": null
      },
      "status": "approved",
      "deprecation": null,
      "default": false
    }
  ]
}
